smartctl version 5.38 [i686-pc-linux-gnu] Copyright (C) 2002-8 Bruce Allen
Home page is http://smartmontools.sourceforge.net/

=== START OF INFORMATION SECTION ===
Model Family:     Seagate Momentus 5400.3
Device Model:     ST9160821A
Serial Number:    5MACW567
Firmware Version: 3.ALE
User Capacity:    160.041.885.696 bytes
Device is:        In smartctl database [for details use: -P show]
ATA Version is:   6
ATA Standard is:  ATA/ATAPI-6 T13 1410D revision 2
Local Time is:    Sun Dec 14 16:45:19 2008 CET
SMART support is: Available - device has SMART capability.
SMART support is: Enabled

=== START OF READ SMART DATA SECTION ===
SMART overall-health self-assessment test result: PASSED

General SMART Values:
Offline data collection status:  (0x82) Offline data collection activity
                                        was completed without error.
                                        Auto Offline Data Collection: Enabled.
Self-test execution status:      ( 121) The previous self-test completed having
                                        the read element of the test failed.
Total time to complete Offline
data collection:                 ( 426) seconds.
Offline data collection
capabilities:                    (0x5b) SMART execute Offline immediate.
                                        Auto Offline data collection on/off support.
                                        Suspend Offline collection upon new
                                        command.
                                        Offline surface scan supported.
                                        Self-test supported.
                                        No Conveyance Self-test supported.
                                        Selective Self-test supported.
SMART capabilities:            (0x0003) Saves SMART data before entering
                                        power-saving mode.
                                        Supports SMART auto save timer.
Error logging capability:        (0x01) Error logging supported.
                                        No General Purpose Logging support.
Short self-test routine
recommended polling time:        (   1) minutes.
Extended self-test routine
recommended polling time:        ( 165) minutes.
SCT capabilities:              (0x0001) SCT Status supported.

SMART Attributes Data Structure revision number: 10
Vendor Specific SMART Attributes with Thresholds:
ID# ATTRIBUTE_NAME          FLAG     VALUE WORST THRESH TYPE      UPDATED  WHEN_FAILED RAW_VALUE
  1 Raw_Read_Error_Rate     0x000f   100   253   006    Pre-fail  Always       -       1574094
  3 Spin_Up_Time            0x0003   099   099   000    Pre-fail  Always       -       0
  4 Start_Stop_Count        0x0032   100   100   020    Old_age   Always       -       30
  5 Reallocated_Sector_Ct   0x0033   100   100   036    Pre-fail  Always       -       0
  7 Seek_Error_Rate         0x000f   100   253   030    Pre-fail  Always       -       8590557469
  9 Power_On_Hours          0x0032   100   100   000    Old_age   Always       -       14
 10 Spin_Retry_Count        0x0013   100   100   034    Pre-fail  Always       -       0
 12 Power_Cycle_Count       0x0032   100   100   020    Old_age   Always       -       27
187 Reported_Uncorrect      0x0032   100   100   000    Old_age   Always       -       0
189 High_Fly_Writes         0x003a   100   100   000    Old_age   Always       -       0
190 Airflow_Temperature_Cel 0x0022   070   066   045    Old_age   Always       -       30 (Lifetime Min/Max 25/32)
192 Power-Off_Retract_Count 0x0032   100   100   000    Old_age   Always       -       13
193 Load_Cycle_Count        0x0032   100   100   000    Old_age   Always       -       806
194 Temperature_Celsius     0x0022   030   040   000    Old_age   Always       -       30 (0 12 0 0)
195 Hardware_ECC_Recovered  0x001a   071   064   000    Old_age   Always       -       208277232
197 Current_Pending_Sector  0x0012   100   100   000    Old_age   Always       -       2
198 Offline_Uncorrectable   0x0010   100   100   000    Old_age   Offline      -       2
199 UDMA_CRC_Error_Count    0x003e   200   200   000    Old_age   Always       -       0
200 Multi_Zone_Error_Rate   0x0000   100   253   000    Old_age   Offline      -       0
202 TA_Increase_Count       0x0032   100   253   000    Old_age   Always       -       0

SMART Error Log Version: 1
No Errors Logged

SMART Self-test log structure revision number 1
Num  Test_Description    Status                  Remaining  LifeTime(hours)  LBA_of_first_error
# 1  Extended offline    Completed: read failure       90%        14         24405040
# 2  Short offline       Completed without error       00%        14         -
# 3  Extended offline    Completed: read failure       90%        13         24405040
# 4  Extended offline    Completed: read failure       90%        13         24405040
# 5  Short offline       Completed without error       00%        12         -
# 6  Extended offline    Completed: read failure       90%        12         24405040
# 7  Extended offline    Aborted by host               90%        12         -
# 8  Short offline       Aborted by host               80%         1         -

SMART Selective self-test log data structure revision number 1
 SPAN  MIN_LBA  MAX_LBA  CURRENT_TEST_STATUS
    1        0        0  Not_testing
    2        0        0  Not_testing
    3        0        0  Not_testing
    4        0        0  Not_testing
    5        0        0  Not_testing
Selective self-test flags (0x0):
  After scanning selected spans, do NOT read-scan remainder of disk.
If Selective self-test is pending on power-up, resume after 0 minute delay.