smartctl version 5.38 [i686-pc-linux-gnu] Copyright (C) 2002-8 Bruce Allen
Home page is http://smartmontools.sourceforge.net/

=== START OF INFORMATION SECTION ===
Device Model:     STEC PATA 8GB
Serial Number:    STM00003E238
Firmware Version: C5221-10
User Capacity:    7,682,605,056 bytes
Device is:        Not in smartctl database [for details use: -P showall]
ATA Version is:   6
ATA Standard is:  Exact ATA specification draft version not indicated
Local Time is:    Thu Feb 10 14:14:14 2011 UTC
SMART support is: Available - device has SMART capability.
SMART support is: Enabled

=== START OF READ SMART DATA SECTION ===
SMART overall-health self-assessment test result: FAILED!
Drive failure expected in less than 24 hours. SAVE ALL DATA.
See vendor-specific Attribute list for failed Attributes.

General SMART Values:
Offline data collection status:  (0x00)	Offline data collection activity
					was never started.
					Auto Offline Data Collection: Disabled.
Self-test execution status:      (   0)	The previous self-test routine completed
					without error or no self-test has ever
					been run.
Total time to complete Offline
data collection: 		 ( 430) seconds.
Offline data collection
capabilities: 			 (0x59) SMART execute Offline immediate.
					No Auto Offline data collection support.
					Suspend Offline collection upon new
					command.
					Offline surface scan supported.
					Self-test supported.
					No Conveyance Self-test supported.
					Selective Self-test supported.
SMART capabilities:            (0x0002)	Does not save SMART data before
					entering power-saving mode.
					Supports SMART auto save timer.
Error logging capability:        (0x01)	Error logging supported.
					No General Purpose Logging support.
Short self-test routine
recommended polling time: 	 (   1) minutes.
Extended self-test routine
recommended polling time: 	 ( 115) minutes.

SMART Attributes Data Structure revision number: 10
Vendor Specific SMART Attributes with Thresholds:
ID# ATTRIBUTE_NAME          FLAG     VALUE WORST THRESH TYPE      UPDATED  WHEN_FAILED RAW_VALUE
  1 Raw_Read_Error_Rate     0x002f   100   100   025    Pre-fail  Always       -       3576
  2 Throughput_Performance  0x0027   100   100   025    Pre-fail  Always       -       0
  5 Reallocated_Sector_Ct   0x0033   100   100   010    Pre-fail  Always       -       0
  9 Power_On_Hours          0x0032   100   100   000    Old_age   Always       -       80
 12 Power_Cycle_Count       0x0032   100   100   000    Old_age   Always       -       68
 13 Read_Soft_Error_Rate    0x002e   100   100   010    Old_age   Always       -       0
100 Unknown_Attribute       0x0032   005   005   005    Old_age   Always   FAILING_NOW 3123299421
103 Unknown_Attribute       0x0002   100   100   090    Old_age   Always       -       0
170 Unknown_Attribute       0x0033   000   000   010    Pre-fail  Always   FAILING_NOW 4294967295
171 Unknown_Attribute       0x0032   100   100   010    Old_age   Always       -       0
172 Unknown_Attribute       0x0032   100   100   010    Old_age   Always       -       0
173 Unknown_Attribute       0x0032   000   000   000    Old_age   Always   FAILING_NOW 0
174 Unknown_Attribute       0x0032   000   000   000    Old_age   Always   FAILING_NOW 0
184 Unknown_Attribute       0x0033   100   100   090    Pre-fail  Always       -       0
187 Reported_Uncorrect      0x0032   070   070   001    Old_age   Always       -       28896
188 Unknown_Attribute       0x0032   000   000   000    Old_age   Always   FAILING_NOW 0
194 Temperature_Celsius     0x0002   000   000   000    Old_age   Always   FAILING_NOW 0
196 Reallocated_Event_Count 0x0002   100   100   025    Old_age   Always       -       0
198 Offline_Uncorrectable   0x0003   100   100   025    Pre-fail  Always       -       0
199 UDMA_CRC_Error_Count    0x0032   000   000   000    Old_age   Always   FAILING_NOW 0

SMART Error Log Version: 1
No Errors Logged

SMART Self-test log structure revision number 1
No self-tests have been logged.  [To run self-tests, use: smartctl -t]


SMART Selective self-test log data structure revision number 1
 SPAN  MIN_LBA  MAX_LBA  CURRENT_TEST_STATUS
    1        0        0  Not_testing
    2        0        0  Not_testing
    3        0        0  Not_testing
    4        0        0  Not_testing
    5        0        0  Not_testing
Selective self-test flags (0x0):
  After scanning selected spans, do NOT read-scan remainder of disk.
If Selective self-test is pending on power-up, resume after 0 minute delay.
